{"campaign_id":"table","encounter_id":"battle","version":3,"status":"ended","round":1,"active_index":-1,"participants":[{"id":"aria","name":"Aria","initiative":18,"max_hp":30,"current_hp":23,"conditions":[]}],"operation":"end","operation_id":"encounter-aaaaaaaaaaaaaaaaaaaaaaaaaaaaaaaaaaaaaaaaaaaaaaaaaaaaaaaaaaaaaaaa","active_participant_id":"","previous_state":{"campaign_id":"table","encounter_id":"battle","version":2,"status":"active","round":1,"active_index":0,"participants":[{"id":"aria","name":"Aria","initiative":18,"max_hp":30,"current_hp":23,"conditions":[]}]}}
