{"campaign_id":"table","encounter_id":"battle","version":3,"status":"active","round":1,"active_index":0,"participants":[{"id":"aria","name":"Aria","initiative":18,"max_hp":30,"current_hp":30,"conditions":[]}],"operation":"heal","operation_id":"encounter-aaaaaaaaaaaaaaaaaaaaaaaaaaaaaaaaaaaaaaaaaaaaaaaaaaaaaaaaaaaaaaaa","active_participant_id":"aria","previous_state":{"campaign_id":"table","encounter_id":"battle","version":2,"status":"active","round":1,"active_index":0,"participants":[{"id":"aria","name":"Aria","initiative":18,"max_hp":30,"current_hp":23,"conditions":[]}]},"participant_id":"aria","amount":7}
